CVE-2022-41654,An authentication bypass vulnerability exists in the newsletter subscription functionality of Ghost Foundation Ghost 5.9.4. A specially-crafted HTTP request can lead to increased privileges. An attacker can send an HTTP request to trigger this vulnerability.
CVE-2022-3875,A vulnerability classified as critical was found in Click Studios Passwordstate and Passwordstate Browser Extension Chrome. This vulnerability affects unknown code of the component API. The manipulation leads to authentication bypass by assumed-immutable data. The attack can be initiated remotely. The exploit has been disclosed to the public and may be used. It is recommended to upgrade the affected component. The identifier of this vulnerability is VDB-216244.
CVE-2022-3877,"A vulnerability, which was classified as problematic, was found in Click Studios Passwordstate and Passwordstate Browser Extension Chrome. Affected is an unknown function of the component URL Field Handler. The manipulation leads to cross site scripting. It is possible to launch the attack remotely. The exploit has been disclosed to the public and may be used. It is recommended to upgrade the affected component. VDB-216246 is the identifier assigned to this vulnerability."
CVE-2022-3876,"A vulnerability, which was classified as problematic, has been found in Click Studios Passwordstate and Passwordstate Browser Extension Chrome. This issue affects some unknown processing of the file /api/browserextension/UpdatePassword/ of the component API. The manipulation of the argument PasswordID leads to authorization bypass. The attack may be initiated remotely. The exploit has been disclosed to the public and may be used. It is recommended to upgrade the affected component. The identifier VDB-216245 was assigned to this vulnerability."
CVE-2019-10655,"Grandstream GAC2500 1.0.3.35, GXP2200 1.0.3.27, GVC3202 1.0.3.51, GXV3275 before 1.0.3.219 Beta, and GXV3240 before 1.0.3.219 Beta devices allow unauthenticated remote code execution via shell metacharacters in a /manager?action=getlogcat priority field, in conjunction with a buffer overflow (via the phonecookie cookie) to overwrite a data structure and consequently bypass authentication. This can be exploited remotely or via CSRF because the cookie can be placed in an Accept HTTP header in an XMLHttpRequest call to lighttpd."
CVE-2017-17105,"Zivif PR115-204-P-RS V2.3.4.2103 and V4.7.4.2121 (and possibly in-between versions) web cameras are vulnerable to unauthenticated, blind remote command injection via CGI scripts used as part of the web interface, as demonstrated by a cgi-bin/iptest.cgi?cmd=iptest.cgi&-time=""1504225666237""&-url=$(reboot) request."
CVE-2022-33891,"The Apache Spark UI offers the possibility to enable ACLs via the configuration option spark.acls.enable. With an authentication filter, this checks whether a user has access permissions to view or modify the application. If ACLs are enabled, a code path in HttpSecurityFilter can allow someone to perform impersonation by providing an arbitrary user name. A malicious user might then be able to reach a permission check function that will ultimately build a Unix shell command based on their input, and execute it. This will result in arbitrary shell command execution as the user Spark is currently running as. This affects Apache Spark versions 3.0.3 and earlier, versions 3.1.1 to 3.1.2, and versions 3.2.0 to 3.2.1."
CVE-2021-42013,"It was found that the fix for CVE-2021-41773 in Apache HTTP Server 2.4.50 was insufficient. An attacker could use a path traversal attack to map URLs to files outside the directories configured by Alias-like directives. If files outside of these directories are not protected by the usual default configuration ""require all denied"", these requests can succeed. If CGI scripts are also enabled for these aliased pathes, this could allow for remote code execution. This issue only affects Apache 2.4.49 and Apache 2.4.50 and not earlier versions."
CVE-2022-30023,Tenda ONT GPON AC1200 Dual band WiFi HG9 v1.0.1 is vulnerable to Command Injection via the Ping function.
CVE-2022-31137,"Roxy-WI is a web interface for managing Haproxy, Nginx, Apache and Keepalived servers. Versions prior to 6.1.1.0 are subject to a remote code execution vulnerability. System commands can be run remotely via the subprocess_execute function without processing the inputs received from the user in the /app/options.py file. Attackers need not be authenticated to exploit this vulnerability. Users are advised to upgrade. There are no known workarounds for this vulnerability."
CVE-2020-25223,"A remote code execution vulnerability exists in the WebAdmin of Sophos SG UTM before v9.705 MR5, v9.607 MR7, and v9.511 MR11"
CVE-2022-42821,"A logic issue was addressed with improved checks. This issue is fixed in macOS Monterey 12.6.2, macOS Big Sur 11.7.2, macOS Ventura 13. An app may bypass Gatekeeper checks."
CVE-2022-37967,Windows Kerberos Elevation of Privilege Vulnerability.
CVE-2022-37966,Windows Kerberos RC4-HMAC Elevation of Privilege Vulnerability.
CVE-2022-38023,Netlogon RPC Elevation of Privilege Vulnerability.
CVE-2022-26501,Veeam Backup & Replication 10.x and 11.x has Incorrect Access Control (issue 1 of 2).
CVE-2022-26500,"Improper limitation of path names in Veeam Backup & Replication 9.5U3, 9.5U4,10.x, and 11.x allows remote authenticated users access to internal API functions that allows attackers to upload and execute arbitrary code."
CVE-2017-0144,"The SMBv1 server in Microsoft Windows Vista SP2; Windows Server 2008 SP2 and R2 SP1; Windows 7 SP1; Windows 8.1; Windows Server 2012 Gold and R2; Windows RT 8.1; and Windows 10 Gold, 1511, and 1607; and Windows Server 2016 allows remote attackers to execute arbitrary code via crafted packets, aka ""Windows SMB Remote Code Execution Vulnerability."" This vulnerability is different from those described in CVE-2017-0143, CVE-2017-0145, CVE-2017-0146, and CVE-2017-0148."
CVE-2022-37958,SPNEGO Extended Negotiation (NEGOEX) Security Mechanism Information Disclosure Vulnerability.
CVE-2022-44710,DirectX Graphics Kernel Elevation of Privilege Vulnerability.
CVE-2022-41091,Windows Mark of the Web Security Feature Bypass Vulnerability. This CVE ID is unique from CVE-2022-41049.
CVE-2022-44698,Windows SmartScreen Security Feature Bypass Vulnerability.
CVE-2022-44704,Microsoft Windows Sysmon Elevation of Privilege Vulnerability.
CVE-2022-41076,PowerShell Remote Code Execution Vulnerability.
CVE-2022-44681,Windows Print Spooler Elevation of Privilege Vulnerability. This CVE ID is unique from CVE-2022-44678.
CVE-2022-44678,Windows Print Spooler Elevation of Privilege Vulnerability. This CVE ID is unique from CVE-2022-44681.
CVE-2022-22674,"An out-of-bounds read issue existed that led to the disclosure of kernel memory. This was addressed with improved input validation. This issue is fixed in macOS Monterey 12.3.1, Security Update 2022-004 Catalina, macOS Big Sur 11.6.6. A local user may be able to read kernel memory."
CVE-2022-32917,"The issue was addressed with improved bounds checks. This issue is fixed in macOS Monterey 12.6, iOS 15.7 and iPadOS 15.7, iOS 16, macOS Big Sur 11.7. An application may be able to execute arbitrary code with kernel privileges. Apple is aware of a report that this issue may have been actively exploited.."
CVE-2022-22594,"A cross-origin issue in the IndexDB API was addressed with improved input validation. This issue is fixed in iOS 15.3 and iPadOS 15.3, watchOS 8.4, tvOS 15.3, Safari 15.3, macOS Monterey 12.2. A website may be able to track sensitive user information."
CVE-2022-22620,"A use after free issue was addressed with improved memory management. This issue is fixed in macOS Monterey 12.2.1, iOS 15.3.1 and iPadOS 15.3.1, Safari 15.3 (v. 16612.4.9.1.8 and 15612.4.9.1.8). Processing maliciously crafted web content may lead to arbitrary code execution. Apple is aware of a report that this issue may have been actively exploited.."
CVE-2022-22675,"An out-of-bounds write issue was addressed with improved bounds checking. This issue is fixed in tvOS 15.5, watchOS 8.6, macOS Big Sur 11.6.6, macOS Monterey 12.3.1, iOS 15.4.1 and iPadOS 15.4.1. An application may be able to execute arbitrary code with kernel privileges. Apple is aware of a report that this issue may have been actively exploited.."
CVE-2022-42827,"An out-of-bounds write issue was addressed with improved bounds checking. This issue is fixed in iOS 15.7.1 and iPadOS 15.7.1, iOS 16.1 and iPadOS 16. An application may be able to execute arbitrary code with kernel privileges. Apple is aware of a report that this issue may have been actively exploited.."
CVE-2022-32893,"An out-of-bounds write issue was addressed with improved bounds checking. This issue is fixed in iOS 15.6.1 and iPadOS 15.6.1, macOS Monterey 12.5.1, Safari 15.6.1. Processing maliciously crafted web content may lead to arbitrary code execution. Apple is aware of a report that this issue may have been actively exploited."
CVE-2022-32894,"An out-of-bounds write issue was addressed with improved bounds checking. This issue is fixed in iOS 15.6.1 and iPadOS 15.6.1, macOS Monterey 12.5.1. An application may be able to execute arbitrary code with kernel privileges. Apple is aware of a report that this issue may have been actively exploited."
CVE-2022-22587,"A memory corruption issue was addressed with improved input validation. This issue is fixed in iOS 15.3 and iPadOS 15.3, macOS Big Sur 11.6.3, macOS Monterey 12.2. A malicious application may be able to execute arbitrary code with kernel privileges. Apple is aware of a report that this issue may have been actively exploited.."
CVE-2021-22893,Pulse Connect Secure 9.0R3/9.1R1 and higher is vulnerable to an authentication bypass vulnerability exposed by the Windows File Share Browser and Pulse Secure Collaboration features of Pulse Connect Secure that can allow an unauthenticated user to perform remote arbitrary code execution on the Pulse Connect Secure gateway. This vulnerability has been exploited in the wild.
CVE-2022-40684,"An authentication bypass using an alternate path or channel [CWE-288] in Fortinet FortiOS version 7.2.0 through 7.2.1 and 7.0.0 through 7.0.6, FortiProxy version 7.2.0 and version 7.0.0 through 7.0.6 and FortiSwitchManager version 7.2.0 and 7.0.0 allows an unauthenticated atttacker to perform operations on the administrative interface via specially crafted HTTP or HTTPS requests."
CVE-2022-45797,An arbitrary file deletion vulnerability in the Damage Cleanup Engine component of Trend Micro Apex One and Trend Micro Apex One as a Service could allow a local attacker to escalate privileges and delete files on affected installations. Please note: an attacker must first obtain the ability to execute low-privileged code on the target system in order to exploit this vulnerability.
CVE-2022-37971,Microsoft Windows Defender Elevation of Privilege Vulnerability.
CVE-2022-4173,"A vulnerability within the malware removal functionality of Avast and AVG Antivirus allowed an attacker with write access to the filesystem, to escalate his privileges in certain scenarios. The issue was fixed with Avast and AVG Antivirus version 22.10."
CVE-2022-31199,"Remote code execution vulnerabilities exist in the Netwrix Auditor User Activity Video Recording component affecting both the Netwrix Auditor server and agents installed on monitored systems. The remote code execution vulnerabilities exist within the underlying protocol used by the component, and potentially allow an unauthenticated remote attacker to execute arbitrary code as the NT AUTHORITY\SYSTEM user on affected systems, including on systems Netwrix Auditor monitors."
CVE-2021-44228,"Apache Log4j2 2.0-beta9 through 2.15.0 (excluding security releases 2.12.2, 2.12.3, and 2.3.1) JNDI features used in configuration, log messages, and parameters do not protect against attacker controlled LDAP and other JNDI related endpoints. An attacker who can control log messages or log message parameters can execute arbitrary code loaded from LDAP servers when message lookup substitution is enabled. From log4j 2.15.0, this behavior has been disabled by default. From version 2.16.0 (along with 2.12.2, 2.12.3, and 2.3.1), this functionality has been completely removed. Note that this vulnerability is specific to log4j-core and does not affect log4net, log4cxx, or other Apache Logging Services projects."
CVE-2021-26411,Internet Explorer Memory Corruption Vulnerability
CVE-2020-1380,"A remote code execution vulnerability exists in the way that the scripting engine handles objects in memory in Internet Explorer, aka 'Scripting Engine Memory Corruption Vulnerability'. This CVE ID is unique from CVE-2020-1555, CVE-2020-1570."
CVE-2022-41128,Windows Scripting Languages Remote Code Execution Vulnerability. This CVE ID is unique from CVE-2022-41118.
CVE-2021-35464,"ForgeRock AM server before 7.0 has a Java deserialization vulnerability in the jato.pageSession parameter on multiple pages. The exploitation does not require authentication, and remote code execution can be triggered by sending a single crafted /ccversion/* request to the server. The vulnerability exists due to the usage of Sun ONE Application Framework (JATO) found in versions of Java 8 or earlier"
CVE-2021-44731,"A race condition existed in the snapd 2.54.2 snap-confine binary when preparing a private mount namespace for a snap. This could allow a local attacker to gain root privileges by bind-mounting their own contents inside the snap's private mount namespace and causing snap-confine to execute arbitrary code and hence gain privilege escalation. Fixed in snapd versions 2.54.3+18.04, 2.54.3+20.04 and 2.54.3+21.10.1"
CVE-2022-41973,"multipath-tools 0.7.7 through 0.9.x before 0.9.2 allows local users to obtain root access, as exploited in conjunction with CVE-2022-41974. Local users able to access /dev/shm can change symlinks in multipathd due to incorrect symlink handling, which could lead to controlled file writes outside of the /dev/shm directory. This could be used indirectly for local privilege escalation to root."
CVE-2022-41974,"multipath-tools 0.7.0 through 0.9.x before 0.9.2 allows local users to obtain root access, as exploited alone or in conjunction with CVE-2022-41973. Local users able to write to UNIX domain sockets can bypass access controls and manipulate the multipath setup. This can lead to local privilege escalation to root. This occurs because an attacker can repeat a keyword, which is mishandled because arithmetic ADD is used instead of bitwise OR."
CVE-2022-1364,Type confusion in V8 Turbofan in Google Chrome prior to 100.0.4896.127 allowed a remote attacker to potentially exploit heap corruption via a crafted HTML page.
CVE-2022-1096,Type confusion in V8 in Google Chrome prior to 99.0.4844.84 allowed a remote attacker to potentially exploit heap corruption via a crafted HTML page.
CVE-2022-2294,Heap buffer overflow in WebRTC in Google Chrome prior to 103.0.5060.114 allowed a remote attacker to potentially exploit heap corruption via a crafted HTML page.
CVE-2022-4135,Heap buffer overflow in GPU in Google Chrome prior to 107.0.5304.121 allowed a remote attacker who had compromised the renderer process to potentially perform a sandbox escape via a crafted HTML page. (Chromium security severity: High)
CVE-2022-4262,Type confusion in V8 in Google Chrome prior to 108.0.5359.94 allowed a remote attacker to potentially exploit heap corruption via a crafted HTML page. (Chromium security severity: High)
CVE-2022-0609,Use after free in Animation in Google Chrome prior to 98.0.4758.102 allowed a remote attacker to potentially exploit heap corruption via a crafted HTML page.
CVE-2022-3723,Type confusion in V8 in Google Chrome prior to 107.0.5304.87 allowed a remote attacker to potentially exploit heap corruption via a crafted HTML page. (Chromium security severity: High)
CVE-2022-2856,Insufficient validation of untrusted input in Intents in Google Chrome on Android prior to 104.0.5112.101 allowed a remote attacker to arbitrarily browse to a malicious website via a crafted HTML page.
CVE-2022-3075,Insufficient data validation in Mojo in Google Chrome prior to 105.0.5195.102 allowed a remote attacker who had compromised the renderer process to potentially perform a sandbox escape via a crafted HTML page.
CVE-2022-29830,"Use of Hard-coded Cryptographic Key vulnerability in Mitsubishi Electric GX Works3 all versions allows a remote unauthenticated attacker to disclose or tamper with sensitive information. As a result, unauthorized users may obtain information about project files illegally."
CVE-2022-25164,"Cleartext Storage of Sensitive Information vulnerability in Mitsubishi Electric GX Works3 all versions and Mitsubishi Electric MX OPC UA Module Configurator-R all versions allows a remote unauthenticated attacker to disclose sensitive information. As a result, unauthorized users can gain unauthorized access to the CPU module and the OPC UA server module."
CVE-2022-40265,"Improper Input Validation vulnerability in Mitsubishi Electric Corporation MELSEC iQ-R Series RJ71EN71 Firmware version ""65"" and prior and Mitsubishi Electric Corporation MELSEC iQ-R Series R04/08/16/32/120ENCPU Network Part Firmware version ""65"" and prior allows a remote unauthenticated attacker to cause a Denial of Service condition by sending specially crafted packets. A system reset is required for recovery."
CVE-2022-29831,Use of Hard-coded Password vulnerability in Mitsubishi Electric Corporation GX Works3 versions 1.015R and later allows a remote unauthorized attacker to obtain information about the project file for MELSEC safety CPU modules.
CVE-2022-45483,Lazy Mouse allows an attacker (in a man in the middle position between the server and a connected device) to see all data (including keypresses) in cleartext. CVSS:3.1/AV:L/AC:H/PR:N/UI:N/S:U/C:H/I:N/A:N
CVE-2022-24521,Windows Common Log File System Driver Elevation of Privilege Vulnerability. This CVE ID is unique from CVE-2022-24481.
CVE-2020-1472,"An elevation of privilege vulnerability exists when an attacker establishes a vulnerable Netlogon secure channel connection to a domain controller, using the Netlogon Remote Protocol (MS-NRPC), aka 'Netlogon Elevation of Privilege Vulnerability'."
CVE-2021-42298,Microsoft Defender Remote Code Execution Vulnerability
CVE-2022-4116,A vulnerability was found in quarkus. This security flaw happens in Dev UI Config Editor which is vulnerable to drive-by localhost attacks leading to remote code execution.
CVE-2022-22515,"A remote, authenticated attacker could utilize the control program of the CODESYS Control runtime system to use the vulnerability in order to read and modify the configuration file(s) of the affected products."
CVE-2022-31806,In CODESYS V2 PLCWinNT and Runtime Toolkit 32 in versions prior to V2.4.7.57 password protection is not enabled by default and there is no information or prompt to enable password protection at login in case no password is set at the controller.
CVE-2022-3079,"Festo control block CPX-CEC-C1 and CPX-CMXX in multiple versions allow unauthenticated, remote access to critical webpage functions which may cause a denial of service."
CVE-2022-4020,Vulnerability in the HQSwSmiDxe DXE driver on some consumer Acer Notebook devices may allow an attacker with elevated privileges to modify UEFI Secure Boot settings by modifying an NVRAM variable.
CVE-2021-35587,"Vulnerability in the Oracle Access Manager product of Oracle Fusion Middleware (component: OpenSSO Agent). Supported versions that are affected are 11.1.2.3.0, 12.2.1.3.0 and 12.2.1.4.0. Easily exploitable vulnerability allows unauthenticated attacker with network access via HTTP to compromise Oracle Access Manager. Successful attacks of this vulnerability can result in takeover of Oracle Access Manager. CVSS 3.1 Base Score 9.8 (Confidentiality, Integrity and Availability impacts). CVSS Vector: (CVSS:3.1/AV:N/AC:L/PR:N/UI:N/S:U/C:H/I:H/A:H)."
CVE-2021-26728,Command injection and stack-based buffer overflow vulnerabilities in the KillDupUsr_func function of spx_restservice allow an attacker to execute arbitrary code with the same privileges as the server user (root). This issue affects: Lanner Inc IAC-AST2500A standard firmware version 1.10.0.
CVE-2021-44467,"A broken access control vulnerability in the KillDupUsr_func function of spx_restservice allows an attacker to arbitrarily terminate active sessions of other users, causing a Denial-of-Service (DoS) condition. This issue affects: Lanner Inc IAC-AST2500A standard firmware version 1.10.0."
CVE-2021-26730,A stack-based buffer overflow vulnerability in a subfunction of the Login_handler_func function of spx_restservice allows an attacker to execute arbitrary code with the same privileges as the server user (root). This issue affects: Lanner Inc IAC-AST2500A standard firmware version 1.10.0.
CVE-2021-26727,Multiple command injections and stack-based buffer overflows vulnerabilities in the SubNet_handler_func function of spx_restservice allow an attacker to execute arbitrary code with the same privileges as the server user (root). This issue affects: Lanner Inc IAC-AST2500A standard firmware version 1.10.0.
CVE-2021-4228,Use of hard-coded TLS certificate by default allows an attacker to perform Man-in-the-Middle (MitM) attacks even in the presence of the HTTPS connection. This issue affects: Lanner Inc IAC-AST2500A standard firmware version 1.00.0.
CVE-2022-36449,"An issue was discovered in the Arm Mali GPU Kernel Driver. A non-privileged user can make improper GPU processing operations to gain access to already freed memory, write a limited amount outside of buffer bounds, or to disclose details of memory mappings. This affects Midgard r4p0 through r32p0, Bifrost r0p0 through r38p0 and r39p0 before r38p1, and Valhall r19p0 through r38p0 and r39p0 before r38p1."
CVE-2022-33917,An issue was discovered in the Arm Mali GPU Kernel Driver (Valhall r29p0 through r38p0). A non-privileged user can make improper GPU processing operations to gain access to already freed memory.
CVE-2021-33558,"Boa 0.94.13 allows remote attackers to obtain sensitive information via a misconfiguration involving backup.html, preview.html, js/log.js, log.html, email.html, online-users.html, and config.js."
CVE-2017-9833,"/cgi-bin/wapopen in BOA Webserver 0.94.14rc21 allows the injection of ""../.."" using the FILECAMERA variable (sent by GET) to read files with root privileges."
CVE-2022-43782,"Affected versions of Atlassian Crowd allow an attacker to authenticate as the crowd application via security misconfiguration and subsequent ability to call privileged endpoints in Crowd's REST API under the {{usermanagement}} path. This vulnerability can only be exploited by IPs specified under the crowd application allowlist in the Remote Addresses configuration, which is {{none}} by default. The affected versions are all versions 3.x.x, versions 4.x.x before version 4.4.4, and versions 5.x.x before 5.0.3"
CVE-2022-43781,There is a command injection vulnerability using environment variables in Bitbucket Server and Data Center. An attacker with permission to control their username can exploit this issue to execute arbitrary code on the system. This vulnerability can be unauthenticated if the Bitbucket Server and Data Center instance has enabled “Allow public signup”.
CVE-2022-36804,"Multiple API endpoints in Atlassian Bitbucket Server and Data Center 7.0.0 before version 7.6.17, from version 7.7.0 before version 7.17.10, from version 7.18.0 before version 7.21.4, from version 8.0.0 before version 8.0.3, from version 8.1.0 before version 8.1.3, and from version 8.2.0 before version 8.2.2, and from version 8.3.0 before 8.3.1 allows remote attackers with read permissions to a public or private Bitbucket repository to execute arbitrary code by sending a malicious HTTP request. This vulnerability was reported via our Bug Bounty Program by TheGrandPew."
CVE-2022-36067,"vm2 is a sandbox that can run untrusted code with whitelisted Node's built-in modules. In versions prior to version 3.9.11, a threat actor can bypass the sandbox protections to gain remote code execution rights on the host running the sandbox. This vulnerability was patched in the release of version 3.9.11 of vm2. There are no known workarounds."
CVE-2019-16098,"The driver in Micro-Star MSI Afterburner 4.6.2.15658 (aka RTCore64.sys and RTCore32.sys) allows any authenticated user to read and write to arbitrary memory, I/O ports, and MSRs. This can be exploited for privilege escalation, code execution under high privileges, and information disclosure. These signed drivers can also be used to bypass the Microsoft driver-signing policy to deploy malicious code."
CVE-2022-0072,"Directory Traversal vulnerability in LiteSpeed Technologies OpenLiteSpeed Web Server and LiteSpeed Web Server dashboards allows Path Traversal. This affects versions from 1.5.11 through 1.5.12, from 1.6.5 through 1.6.20.1, from 1.7.0 before 1.7.16.1"
CVE-2022-0074,Untrusted Search Path vulnerability in LiteSpeed Technologies OpenLiteSpeed Web Server and LiteSpeed Web Server Container allows Privilege Escalation. This affects versions from 1.6.15 before 1.7.16.1.
CVE-2022-0073,Improper Input Validation vulnerability in LiteSpeed Technologies OpenLiteSpeed Web Server and LiteSpeed Web Server dashboards allows Command Injection. This affects 1.7.0 versions before 1.7.16.1.
CVE-2022-20465,"In dismiss and related functions of KeyguardHostViewController.java and related files, there is a possible lockscreen bypass due to a logic error in the code. This could lead to local escalation of privilege with no additional execution privileges needed. User interaction is not needed for exploitation.Product: AndroidVersions: Android-10 Android-11 Android-12 Android-12L Android-13Android ID: A-218500036"
