CVE-2022-27516,User login brute force protection functionality bypass
CVE-2022-27513,Remote desktop takeover via phishing
CVE-2022-0902,"Improper Limitation of a Pathname to a Restricted Directory ('Path Traversal'), Improper Neutralization of Special Elements used in a Command ('Command Injection') vulnerability in flow computer and remote controller products of ABB ( RMC-100 (Standard), RMC-100-LITE, XIO, XFCG5 , XRCG5 , uFLOG5 , UDC) allows an attacker who successfully exploited this vulnerability could insert and run arbitrary code in an affected system node."
CVE-2021-3972,A potential vulnerability by a driver used during manufacturing process on some consumer Lenovo Notebook devices' BIOS that was mistakenly not deactivated may allow an attacker with elevated privileges to modify secure boot setting by modifying an NVRAM variable.
CVE-2021-3971,A potential vulnerability by a driver used during older manufacturing processes on some consumer Lenovo Notebook devices that was mistakenly included in the BIOS image could allow an attacker with elevated privileges to modify firmware protection region by modifying an NVRAM variable.
CVE-2021-3970,A potential vulnerability in LenovoVariable SMI Handler due to insufficient validation in some Lenovo Notebook models BIOS may allow an attacker with local access and elevated privileges to execute arbitrary code.
CVE-2016-7200,"The Chakra JavaScript scripting engine in Microsoft Edge allows remote attackers to execute arbitrary code or cause a denial of service (memory corruption) via a crafted web site, aka ""Scripting Engine Memory Corruption Vulnerability,"" a different vulnerability than CVE-2016-7201, CVE-2016-7202, CVE-2016-7203, CVE-2016-7208, CVE-2016-7240, CVE-2016-7242, and CVE-2016-7243."
CVE-2016-0189,"The Microsoft (1) JScript 5.8 and (2) VBScript 5.7 and 5.8 engines, as used in Internet Explorer 9 through 11 and other products, allow remote attackers to execute arbitrary code or cause a denial of service (memory corruption) via a crafted web site, aka ""Scripting Engine Memory Corruption Vulnerability,"" a different vulnerability than CVE-2016-0187."
CVE-2014-6332,"OleAut32.dll in OLE in Microsoft Windows Server 2003 SP2, Windows Vista SP2, Windows Server 2008 SP2 and R2 SP1, Windows 7 SP1, Windows 8, Windows 8.1, Windows Server 2012 Gold and R2, and Windows RT Gold and 8.1 allows remote attackers to execute arbitrary code via a crafted web site, as demonstrated by an array-redimensioning attempt that triggers improper handling of a size value in the SafeArrayDimen function, aka ""Windows OLE Automation Array Remote Code Execution Vulnerability."""
CVE-2019-9810,"Incorrect alias information in IonMonkey JIT compiler for Array.prototype.slice method may lead to missing bounds check and a buffer overflow. This vulnerability affects Firefox < 66.0.1, Firefox ESR < 60.6.1, and Thunderbird < 60.6.1."
CVE-2019-11708,"Insufficient vetting of parameters passed with the Prompt:Open IPC message between child and parent processes can result in the non-sandboxed parent process opening web content chosen by a compromised child process. When combined with additional vulnerabilities this could result in executing arbitrary code on the user's computer. This vulnerability affects Firefox ESR < 60.7.2, Firefox < 67.0.4, and Thunderbird < 60.7.2."
CVE-2022-30170,Windows Credential Roaming Service Elevation of Privilege Vulnerability.
CVE-2021-35211,"Microsoft discovered a remote code execution (RCE) vulnerability in the SolarWinds Serv-U product utilizing a Remote Memory Escape Vulnerability. If exploited, a threat actor may be able to gain privileged access to the machine hosting Serv-U Only. SolarWinds Serv-U Managed File Transfer and Serv-U Secure FTP for Windows before 15.2.3 HF2 are affected by this vulnerability."
CVE-2022-26134,"In affected versions of Confluence Server and Data Center, an OGNL injection vulnerability exists that would allow an unauthenticated attacker to execute arbitrary code on a Confluence Server or Data Center instance. The affected versions are from 1.3.0 before 7.4.17, from 7.13.0 before 7.13.7, from 7.14.0 before 7.14.3, from 7.15.0 before 7.15.2, from 7.16.0 before 7.16.4, from 7.17.0 before 7.17.4, and from 7.18.0 before 7.18.1."
CVE-2021-44077,"Zoho ManageEngine ServiceDesk Plus before 11306, ServiceDesk Plus MSP before 10530, and SupportCenter Plus before 11014 are vulnerable to unauthenticated remote code execution. This is related to /RestAPI URLs in a servlet, and ImportTechnicians in the Struts configuration."
CVE-2021-40539,Zoho ManageEngine ADSelfService Plus version 6113 and prior is vulnerable to REST API authentication bypass with resultant remote code execution.
CVE-2022-3602,"A buffer overrun can be triggered in X.509 certificate verification, specifically in name constraint checking. Note that this occurs after certificate chain signature verification and requires either a CA to have signed the malicious certificate or for the application to continue certificate verification despite failure to construct a path to a trusted issuer. An attacker can craft a malicious email address to overflow four attacker-controlled bytes on the stack. This buffer overflow could result in a crash (causing a denial of service) or potentially remote code execution. Many platforms implement stack overflow protections which would mitigate against the risk of remote code execution. The risk may be further mitigated based on stack layout for any given platform/compiler. Pre-announcements of CVE-2022-3602 described this issue as CRITICAL. Further analysis based on some of the mitigating factors described above have led this to be downgraded to HIGH. Users are still encouraged to upgrade to a new version as soon as possible. In a TLS client, this can be triggered by connecting to a malicious server. In a TLS server, this can be triggered if the server requests client authentication and a malicious client connects. Fixed in OpenSSL 3.0.7 (Affected 3.0.0,3.0.1,3.0.2,3.0.3,3.0.4,3.0.5,3.0.6)."
CVE-2014-0160,"The (1) TLS and (2) DTLS implementations in OpenSSL 1.0.1 before 1.0.1g do not properly handle Heartbeat Extension packets, which allows remote attackers to obtain sensitive information from process memory via crafted packets that trigger a buffer over-read, as demonstrated by reading private keys, related to d1_both.c and t1_lib.c, aka the Heartbleed bug. CVSS V2 scoring evaluates the impact of the vulnerability on the host where the vulnerability is located. When evaluating the impact of this vulnerability to your organization, take into account the nature of the data that is being protected and act according to your organization’s risk acceptance. While CVE-2014-0160 does not allow unrestricted access to memory on the targeted host, a successful exploit does leak information from memory locations which have the potential to contain particularly sensitive information, e.g., cryptographic keys and passwords.  Theft of this information could enable other attacks on the information system, the impact of which would depend on the sensitivity of the data and functions of that system."
CVE-2016-6309,"statem/statem.c in OpenSSL 1.1.0a does not consider memory-block movement after a realloc call, which allows remote attackers to cause a denial of service (use-after-free) or possibly execute arbitrary code via a crafted TLS session."
CVE-2022-3786,"A buffer overrun can be triggered in X.509 certificate verification, specifically in name constraint checking. Note that this occurs after certificate chain signature verification and requires either a CA to have signed a malicious certificate or for an application to continue certificate verification despite failure to construct a path to a trusted issuer. An attacker can craft a malicious email address in a certificate to overflow an arbitrary number of bytes containing the `.' character (decimal 46) on the stack. This buffer overflow could result in a crash (causing a denial of service). In a TLS client, this can be triggered by connecting to a malicious server. In a TLS server, this can be triggered if the server requests client authentication and a malicious client connects. Fixed in OpenSSL 3.0.7 (Affected 3.0.0,3.0.1,3.0.2,3.0.3,3.0.4,3.0.5,3.0.6)."
CVE-2022-36537,"ZK Framework v9.6.1, 9.6.0.1, 9.5.1.3, 9.0.1.2 and 8.6.4.1 allows attackers to access sensitive information via a crafted POST request sent to the component AuUploader."
CVE-2022-30333,"RARLAB UnRAR before 6.12 on Linux and UNIX allows directory traversal to write to files during an extract (aka unpack) operation, as demonstrated by creating a ~/.ssh/authorized_keys file. NOTE: WinRAR and Android RAR are unaffected."
CVE-2022-22245,"A Path Traversal vulnerability in the J-Web component of Juniper Networks Junos OS allows an authenticated attacker to upload arbitrary files to the device by bypassing validation checks built into Junos OS. The attacker should not be able to execute the file due to validation checks built into Junos OS. Successful exploitation of this vulnerability could lead to loss of filesystem integrity. This issue affects Juniper Networks Junos OS: all versions prior to 19.1R3-S9; 19.2 versions prior to 19.2R3-S6; 19.3 versions prior to 19.3R3-S7; 19.4 versions prior to 19.4R3-S9; 20.1 versions prior to 20.1R3-S5; 20.2 versions prior to 20.2R3-S5; 20.3 versions prior to 20.3R3-S5; 20.4 versions prior to 20.4R3-S4; 21.1 versions prior to 21.1R3-S2; 21.2 versions prior to 21.2R3-S1; 21.3 versions prior to 21.3R2-S2, 21.3R3; 21.4 versions prior to 21.4R1-S2, 21.4R2-S1, 21.4R3; 22.1 versions prior to 22.1R1-S1, 22.1R2."
CVE-2022-22244,"An XPath Injection vulnerability in the J-Web component of Juniper Networks Junos OS allows an unauthenticated attacker sending a crafted POST to reach the XPath channel, which may allow chaining to other unspecified vulnerabilities, leading to a partial loss of confidentiality. This issue affects Juniper Networks Junos OS: all versions prior to 19.1R3-S9; 19.2 versions prior to 19.2R3-S6; 19.3 versions prior to 19.3R3-S7; 19.4 versions prior to 19.4R3-S9; 20.1 versions prior to 20.1R3-S5; 20.2 versions prior to 20.2R3-S5; 20.3 versions prior to 20.3R3-S5; 20.4 versions prior to 20.4R3-S4; 21.1 versions prior to 21.1R3-S3; 21.2 versions prior to 21.2R3-S1; 21.3 versions prior to 21.3R3; 21.4 versions prior to 21.4R1-S2, 21.4R2; 22.1 versions prior to 22.1R1-S1, 22.1R2."
CVE-2022-22243,"An XPath Injection vulnerability due to Improper Input Validation in the J-Web component of Juniper Networks Junos OS allows an authenticated attacker to add an XPath command to the XPath stream, which may allow chaining to other unspecified vulnerabilities, leading to a partial loss of confidentiality. This issue affects Juniper Networks Junos OS: all versions prior to 19.1R3-S9; 19.2 versions prior to 19.2R3-S6; 19.3 versions prior to 19.3R3-S7; 19.4 versions prior to 19.4R2-S7, 19.4R3-S8; 20.1 versions prior to 20.1R3-S5; 20.2 versions prior to 20.2R3-S5; 20.3 versions prior to 20.3R3-S5; 20.4 versions prior to 20.4R3-S4; 21.1 versions prior to 21.1R3-S2; 21.2 versions prior to 21.2R3-S1; 21.3 versions prior to 21.3R2-S2, 21.3R3; 21.4 versions prior to 21.4R1-S2, 21.4R2-S1, 21.4R3; 22.1 versions prior to 22.1R1-S1, 22.1R2."
CVE-2022-22242,"A Cross-site Scripting (XSS) vulnerability in the J-Web component of Juniper Networks Junos OS allows an unauthenticated attacker to run malicious scripts reflected off of J-Web to the victim's browser in the context of their session within J-Web. This issue affects Juniper Networks Junos OS all versions prior to 19.1R3-S9; 19.2 versions prior to 19.2R3-S6; 19.3 versions prior to 19.3R3-S7; 19.4 versions prior to 19.4R2-S7, 19.4R3-S8; 20.1 versions prior to 20.1R3-S5; 20.2 versions prior to 20.2R3-S5; 20.3 versions prior to 20.3R3-S5; 20.4 versions prior to 20.4R3-S4; 21.1 versions prior to 21.1R3-S4; 21.2 versions prior to 21.2R3-S1; 21.3 versions prior to 21.3R3; 21.4 versions prior to 21.4R2; 22.1 versions prior to 22.1R2."
CVE-2022-22241,"An Improper Input Validation vulnerability in the J-Web component of Juniper Networks Junos OS may allow an unauthenticated attacker to access data without proper authorization. Utilizing a crafted POST request, deserialization may occur which could lead to unauthorized local file access or the ability to execute arbitrary commands. This issue affects Juniper Networks Junos OS: all versions prior to 19.1R3-S9; 19.2 versions prior to 19.2R3-S6; 19.3 versions prior to 19.3R3-S7; 19.4 versions prior to 19.4R2-S7, 19.4R3-S9; 20.1 versions prior to 20.1R3-S5; 20.2 versions prior to 20.2R3-S5; 20.3 versions prior to 20.3R3-S5; 20.4 versions prior to 20.4R3-S4; 21.1 versions prior to 21.1R3-S2; 21.2 versions prior to 21.2R3-S1; 21.3 versions prior to 21.3R2-S2, 21.3R3; 21.4 versions prior to 21.4R1-S2, 21.4R2-S1, 21.4R3; 22.1 versions prior to 22.1R1-S1, 22.1R2."
CVE-2022-22246,"A PHP Local File Inclusion (LFI) vulnerability in the J-Web component of Juniper Networks Junos OS may allow a low-privileged authenticated attacker to execute an untrusted PHP file. By chaining this vulnerability with other unspecified vulnerabilities, and by circumventing existing attack requirements, successful exploitation could lead to a complete system compromise. This issue affects Juniper Networks Junos OS: all versions prior to 19.1R3-S9; 19.2 versions prior to 19.2R3-S6; 19.3 versions prior to 19.3R3-S6; 19.4 versions prior to 19.4R2-S7, 19.4R3-S8; 20.1 versions prior to 20.1R3-S5; 20.2 versions prior to 20.2R3-S5; 20.3 versions prior to 20.3R3-S5; 20.4 versions prior to 20.4R3-S4; 21.1 versions prior to 21.1R3-S2; 21.2 versions prior to 21.2R3-S1; 21.3 versions prior to 21.3R2-S2, 21.3R3; 21.4 versions prior to 21.4R1-S2, 21.4R2-S1, 21.4R3; 22.1 versions prior to 22.1R1-S1, 22.1R2."
CVE-2020-3153,"A vulnerability in the installer component of Cisco AnyConnect Secure Mobility Client for Windows could allow an authenticated local attacker to copy user-supplied files to system level directories with system level privileges. The vulnerability is due to the incorrect handling of directory paths. An attacker could exploit this vulnerability by creating a malicious file and copying the file to a system directory. An exploit could allow the attacker to copy malicious files to arbitrary locations with system level privileges. This could include DLL pre-loading, DLL hijacking, and other related attacks. To exploit this vulnerability, the attacker needs valid credentials on the Windows system."
CVE-2018-19323,"The GDrv low-level driver in GIGABYTE APP Center v1.05.21 and earlier, AORUS GRAPHICS ENGINE before 1.57, XTREME GAMING ENGINE before 1.26, and OC GURU II v2.08 exposes functionality to read and write Machine Specific Registers (MSRs)."
CVE-2018-19322,"The GPCIDrv and GDrv low-level drivers in GIGABYTE APP Center v1.05.21 and earlier, AORUS GRAPHICS ENGINE before 1.57, XTREME GAMING ENGINE before 1.26, and OC GURU II v2.08 expose functionality to read/write data from/to IO ports. This could be leveraged in a number of ways to ultimately run code with elevated privileges."
CVE-2018-19321,"The GPCIDrv and GDrv low-level drivers in GIGABYTE APP Center v1.05.21 and earlier, AORUS GRAPHICS ENGINE before 1.57, XTREME GAMING ENGINE before 1.26, and OC GURU II v2.08 expose functionality to read and write arbitrary physical memory. This could be leveraged by a local attacker to elevate privileges."
CVE-2018-19320,"The GDrv low-level driver in GIGABYTE APP Center v1.05.21 and earlier, AORUS GRAPHICS ENGINE before 1.57, XTREME GAMING ENGINE before 1.26, and OC GURU II v2.08 exposes ring0 memcpy-like functionality that could allow a local attacker to take complete control of the affected system."
CVE-2020-3433,"A vulnerability in the interprocess communication (IPC) channel of Cisco AnyConnect Secure Mobility Client for Windows could allow an authenticated, local attacker to perform a DLL hijacking attack. To exploit this vulnerability, the attacker would need to have valid credentials on the Windows system. The vulnerability is due to insufficient validation of resources that are loaded by the application at run time. An attacker could exploit this vulnerability by sending a crafted IPC message to the AnyConnect process. A successful exploit could allow the attacker to execute arbitrary code on the affected machine with SYSTEM privileges. To exploit this vulnerability, the attacker would need to have valid credentials on the Windows system."
CVE-2021-39144,"XStream is a simple library to serialize objects to XML and back again. In affected versions this vulnerability may allow a remote attacker has sufficient rights to execute commands of the host only by manipulating the processed input stream. No user is affected, who followed the recommendation to setup XStream's security framework with a whitelist limited to the minimal required types. XStream 1.4.18 uses no longer a blacklist by default, since it cannot be secured for general purpose."
CVE-2022-35737,SQLite 1.0.12 through 3.39.x before 3.39.2 sometimes allows an array-bounds overflow if billions of bytes are used in a string argument to a C API.
CVE-2022-37981,Windows Event Logging Service Denial of Service Vulnerability.
