CVE-2021-4034,A local privilege escalation vulnerability was found on polkit's pkexec utility. The pkexec application is a setuid tool designed to allow unprivileged users to run commands as privileged users according predefined policies. The current version of pkexec doesn't handle the calling parameters count correctly and ends trying to execute environment variables as commands. An attacker can leverage this by crafting environment variables in such a way it'll induce pkexec to execute arbitrary code. When successfully executed the attack can cause a local privilege escalation given unprivileged users administrative rights on the target machine.
CVE-2022-37042,"Zimbra Collaboration Suite (ZCS) 8.8.15 and 9.0 has mboximport functionality that receives a ZIP archive and extracts files from it. By bypassing authentication (i.e., not having an authtoken), an attacker can upload arbitrary files to the system, leading to directory traversal and remote code execution. NOTE: this issue exists because of an incomplete fix for CVE-2022-27925."
CVE-2022-27925,"Zimbra Collaboration (aka ZCS) 8.8.15 and 9.0 has mboximport functionality that receives a ZIP archive and extracts files from it. An authenticated user with administrator rights has the ability to upload arbitrary files to the system, leading to directory traversal."
CVE-2022-0543,"It was discovered, that redis, a persistent key-value database, due to a packaging issue, is prone to a (Debian-specific) Lua sandbox escape, which could result in remote code execution."
CVE-2022-40259,MegaRAC Default Credentials Vulnerability
CVE-2022-40258,AMI Megarac Weak password hashes for Redfish & API
CVE-2022-26872,AMI Megarac Password reset interception via API
CVE-2022-2827,AMI MegaRAC User Enumeration Vulnerability
CVE-2022-40242,MegaRAC Default Credentials Vulnerability
CVE-2021-45046,"It was found that the fix to address CVE-2021-44228 in Apache Log4j 2.15.0 was incomplete in certain non-default configurations. This could allows attackers with control over Thread Context Map (MDC) input data when the logging configuration uses a non-default Pattern Layout with either a Context Lookup (for example, $${ctx:loginId}) or a Thread Context Map pattern (%X, %mdc, or %MDC) to craft malicious input data using a JNDI Lookup pattern resulting in an information leak and remote code execution in some environments and local code execution in all environments. Log4j 2.16.0 (Java 8) and 2.12.2 (Java 7) fix this issue by removing support for message lookup patterns and disabling JNDI functionality by default."
CVE-2018-13379,"An Improper Limitation of a Pathname to a Restricted Directory (""Path Traversal"") in Fortinet FortiOS 6.0.0 to 6.0.4, 5.6.3 to 5.6.7 and 5.4.6 to 5.4.12 and FortiProxy 2.0.0, 1.2.0 to 1.2.8, 1.1.0 to 1.1.6, 1.0.0 to 1.0.7 under SSL VPN web portal allows an unauthenticated attacker to download system files via special crafted HTTP resource requests."
CVE-2022-27596,"A vulnerability has been reported to affect QNAP device running QuTS hero, QTS. If exploited, this vulnerability allows remote attackers to inject malicious code. We have already fixed this vulnerability in the following versions of QuTS hero, QTS: QuTS hero h5.0.1.2248 build 20221215 and later QTS 5.0.1.2234 build 20221201 and later"
CVE-2021-35394,Realtek Jungle SDK version v2.x up to v3.4.14B provides a diagnostic tool called 'MP Daemon' that is usually compiled as 'UDPServer' binary. The binary is affected by multiple memory corruption vulnerabilities and an arbitrary command injection vulnerability that can be exploited by remote unauthenticated attackers.
CVE-2022-3488,"Processing of repeated responses to the same query, where both responses contain ECS pseudo-options, but where the first is broken in some way, can cause BIND to exit with an assertion failure. 'Broken' in this context is anything that would cause the resolver to reject the query response, such as a mismatch between query and answer name. This issue affects BIND 9 versions 9.11.4-S1 through 9.11.37-S1 and 9.16.8-S1 through 9.16.36-S1."
CVE-2022-3094,"Sending a flood of dynamic DNS updates may cause `named` to allocate large amounts of memory. This, in turn, may cause `named` to exit due to a lack of free memory. We are not aware of any cases where this has been exploited. Memory is allocated prior to the checking of access permissions (ACLs) and is retained during the processing of a dynamic update from a client whose access credentials are accepted. Memory allocated to clients that are not permitted to send updates is released immediately upon rejection. The scope of this vulnerability is limited therefore to trusted clients who are permitted to make dynamic zone changes. If a dynamic update is REFUSED, memory will be released again very quickly. Therefore it is only likely to be possible to degrade or stop `named` by sending a flood of unaccepted dynamic updates comparable in magnitude to a query flood intended to achieve the same detrimental outcome. BIND 9.11 and earlier branches are also affected, but through exhaustion of internal resources rather than memory constraints. This may reduce performance but should not be a significant problem for most servers. Therefore we don't intend to address this for BIND versions prior to BIND 9.16. This issue affects BIND 9 versions 9.16.0 through 9.16.36, 9.18.0 through 9.18.10, 9.19.0 through 9.19.8, and 9.16.8-S1 through 9.16.36-S1."
CVE-2022-3924,"This issue can affect BIND 9 resolvers with `stale-answer-enable yes;` that also make use of the option `stale-answer-client-timeout`, configured with a value greater than zero. If the resolver receives many queries that require recursion, there will be a corresponding increase in the number of clients that are waiting for recursion to complete. If there are sufficient clients already waiting when a new client query is received so that it is necessary to SERVFAIL the longest waiting client (see BIND 9 ARM `recursive-clients` limit and soft quota), then it is possible for a race to occur between providing a stale answer to this older client and sending an early timeout SERVFAIL, which may cause an assertion failure. This issue affects BIND 9 versions 9.16.12 through 9.16.36, 9.18.0 through 9.18.10, 9.19.0 through 9.19.8, and 9.16.12-S1 through 9.16.36-S1."
CVE-2022-3736,"BIND 9 resolver can crash when stale cache and stale answers are enabled, option `stale-answer-client-timeout` is set to a positive integer, and the resolver receives an RRSIG query. This issue affects BIND 9 versions 9.16.12 through 9.16.36, 9.18.0 through 9.18.10, 9.19.0 through 9.19.8, and 9.16.12-S1 through 9.16.36-S1."
CVE-2022-34689,Windows CryptoAPI Spoofing Vulnerability.
CVE-2022-42856,"A type confusion issue was addressed with improved state handling. This issue is fixed in Safari 16.2, tvOS 16.2, macOS Ventura 13.1, iOS 15.7.2 and iPadOS 15.7.2, iOS 16.1.2. Processing maliciously crafted web content may lead to arbitrary code execution. Apple is aware of a report that this issue may have been actively exploited against versions of iOS released before iOS 15.1.."
CVE-2022-42475,"A heap-based buffer overflow vulnerability [CWE-122] in FortiOS SSL-VPN 7.2.0 through 7.2.2, 7.0.0 through 7.0.8, 6.4.0 through 6.4.10, 6.2.0 through 6.2.11, 6.0.15 and earlier and FortiProxy SSL-VPN 7.2.0 through 7.2.1, 7.0.7 and earlier may allow a remote unauthenticated attacker to execute arbitrary code or commands via specifically crafted requests."
CVE-2022-4873,"On Netcomm router models NF20MESH, NF20, and NL1902 a stack based buffer overflow affects the sessionKey parameter. By providing a specific number of bytes, the instruction pointer is able to be overwritten on the stack and crashes the application at a known location."
CVE-2022-4498,"In TP-Link routers, Archer C5 and WR710N-V1, running the latest available code, when receiving HTTP Basic Authentication the httpd service can be sent a crafted packet that causes a heap overflow. This can result in either a DoS (by crashing the httpd process) or an arbitrary code execution."
CVE-2022-4499,"TP-Link routers, Archer C5 and WR710N-V1, using the latest software, the strcmp function used for checking credentials in httpd, is susceptible to a side-channel attack. By measuring the response time of the httpd process, an attacker could guess each byte of the username and password."
CVE-2022-4874,"Authentication bypass in Netcomm router models NF20MESH, NF20, and NL1902 allows an unauthenticated user to access content. In order to serve static content, the application performs a check for the existence of specific characters in the URL (.css, .png etc). If it exists, it performs a ""fake login"" to give the request an active session to load the file and not redirect to the login page."
CVE-2022-41903,"Git is distributed revision control system. `git log` can display commits in an arbitrary format using its `--format` specifiers. This functionality is also exposed to `git archive` via the `export-subst` gitattribute. When processing the padding operators, there is a integer overflow in `pretty.c::format_and_pad_commit()` where a `size_t` is stored improperly as an `int`, and then added as an offset to a `memcpy()`. This overflow can be triggered directly by a user running a command which invokes the commit formatting machinery (e.g., `git log --format=...`). It may also be triggered indirectly through git archive via the export-subst mechanism, which expands format specifiers inside of files within the repository during a git archive. This integer overflow can result in arbitrary heap writes, which may result in arbitrary code execution. The problem has been patched in the versions published on 2023-01-17, going back to v2.30.7. Users are advised to upgrade. Users who are unable to upgrade should disable `git archive` in untrusted repositories. If you expose git archive via `git daemon`, disable it by running `git config --global daemon.uploadArch false`."
CVE-2022-23521,"Git is distributed revision control system. gitattributes are a mechanism to allow defining attributes for paths. These attributes can be defined by adding a `.gitattributes` file to the repository, which contains a set of file patterns and the attributes that should be set for paths matching this pattern. When parsing gitattributes, multiple integer overflows can occur when there is a huge number of path patterns, a huge number of attributes for a single pattern, or when the declared attribute names are huge. These overflows can be triggered via a crafted `.gitattributes` file that may be part of the commit history. Git silently splits lines longer than 2KB when parsing gitattributes from a file, but not when parsing them from the index. Consequentially, the failure mode depends on whether the file exists in the working tree, the index or both. This integer overflow can result in arbitrary heap reads and writes, which may result in remote code execution. The problem has been patched in the versions published on 2023-01-17, going back to v2.30.7. Users are advised to upgrade. There are no known workarounds for this issue."
CVE-2022-46732,"Even if the authentication fails for local service authentication, the requested command could still execute regardless of authentication status."
CVE-2022-2274,The OpenSSL 3.0.4 release introduced a serious bug in the RSA implementation for X86_64 CPUs supporting the AVX512IFMA instructions. This issue makes the RSA implementation with 2048 bit private keys incorrect on such machines and memory corruption will happen during the computation. As a consequence of the memory corruption an attacker may be able to trigger a remote code execution on the machine performing the computation. SSL/TLS servers or other servers using 2048 bit RSA private keys running on machines supporting AVX512IFMA instructions of the X86_64 architecture are affected by this issue.
CVE-2022-35256,The llhttp parser in the http module in Node v18.7.0 does not correctly handle header fields that are not terminated with CLRF. This may result in HTTP Request Smuggling.
CVE-2022-2068,"In addition to the c_rehash shell command injection identified in CVE-2022-1292, further circumstances where the c_rehash script does not properly sanitise shell metacharacters to prevent command injection were found by code review. When the CVE-2022-1292 was fixed it was not discovered that there are other places in the script where the file names of certificates being hashed were possibly passed to a command executed through the shell. This script is distributed by some operating systems in a manner where it is automatically executed. On such operating systems, an attacker could execute arbitrary commands with the privileges of the script. Use of the c_rehash script is considered obsolete and should be replaced by the OpenSSL rehash command line tool. Fixed in OpenSSL 3.0.4 (Affected 3.0.0,3.0.1,3.0.2,3.0.3). Fixed in OpenSSL 1.1.1p (Affected 1.1.1-1.1.1o). Fixed in OpenSSL 1.0.2zf (Affected 1.0.2-1.0.2ze)."
CVE-2022-45092,"A vulnerability has been identified in SINEC INS (All versions < V1.0 SP2 Update 1). An authenticated remote attacker with access to the Web Based Management (443/tcp) of the affected product, could potentially read and write arbitrary files from and to the device's file system. An attacker might leverage this to trigger remote code execution on the affected component."
CVE-2022-44456,CONPROSYS HMI System (CHS) Ver.3.4.4?and earlier allows a remote unauthenticated attacker to execute an arbitrary OS command on the server where the product is running by sending a specially crafted request.
CVE-2022-46823,"A vulnerability has been identified in Mendix SAML (Mendix 8 compatible) (All versions >= V2.3.0 < V2.3.4), Mendix SAML (Mendix 9 compatible, New Track) (All versions >= V3.3.0 < V3.3.9), Mendix SAML (Mendix 9 compatible, Upgrade Track) (All versions >= V3.3.0 < V3.3.8). The affected module is vulnerable to reflected cross-site scripting (XSS) attacks. This could allow an attacker to extract sensitive information by tricking users into accessing a malicious link."
CVE-2023-22600,"InHand Networks InRouter 302, prior to version IR302 V3.5.56, and InRouter 615, prior to version InRouter6XX-S-V2.3.0.r5542, contain vulnerability CWE-284: Improper Access Control. They allow unauthenticated devices to subscribe to MQTT topics on the same network as the device manager. An unauthorized user who knows of an existing topic name could send and receive messages to and from that topic. This includes the ability to send GET/SET configuration commands, reboot commands, and push firmware updates."
CVE-2023-22952,"In SugarCRM before 12.0. Hotfix 91155, a crafted request can inject custom PHP code through the EmailTemplates because of missing input validation."
CVE-2022-46169,"Cacti is an open source platform which provides a robust and extensible operational monitoring and fault management framework for users. In affected versions a command injection vulnerability allows an unauthenticated user to execute arbitrary code on a server running Cacti, if a specific data source was selected for any monitored device. The vulnerability resides in the `remote_agent.php` file. This file can be accessed without authentication. This function retrieves the IP address of the client via `get_client_addr` and resolves this IP address to the corresponding hostname via `gethostbyaddr`. After this, it is verified that an entry within the `poller` table exists, where the hostname corresponds to the resolved hostname. If such an entry was found, the function returns `true` and the client is authorized. This authorization can be bypassed due to the implementation of the `get_client_addr` function. The function is defined in the file `lib/functions.php` and checks serval `$_SERVER` variables to determine the IP address of the client. The variables beginning with `HTTP_` can be arbitrarily set by an attacker. Since there is a default entry in the `poller` table with the hostname of the server running Cacti, an attacker can bypass the authentication e.g. by providing the header `Forwarded-For: <TARGETIP>`. This way the function `get_client_addr` returns the IP address of the server running Cacti. The following call to `gethostbyaddr` will resolve this IP address to the hostname of the server, which will pass the `poller` hostname check because of the default entry. After the authorization of the `remote_agent.php` file is bypassed, an attacker can trigger different actions. One of these actions is called `polldata`. The called function `poll_for_data` retrieves a few request parameters and loads the corresponding `poller_item` entries from the database. If the `action` of a `poller_item` equals `POLLER_ACTION_SCRIPT_PHP`, the function `proc_open` is used to execute a PHP script. The attacker-controlled parameter `$poller_id` is retrieved via the function `get_nfilter_request_var`, which allows arbitrary strings. This variable is later inserted into the string passed to `proc_open`, which leads to a command injection vulnerability. By e.g. providing the `poller_id=;id` the `id` command is executed. In order to reach the vulnerable call, the attacker must provide a `host_id` and `local_data_id`, where the `action` of the corresponding `poller_item` is set to `POLLER_ACTION_SCRIPT_PHP`. Both of these ids (`host_id` and `local_data_id`) can easily be bruteforced. The only requirement is that a `poller_item` with an `POLLER_ACTION_SCRIPT_PHP` action exists. This is very likely on a productive instance because this action is added by some predefined templates like `Device - Uptime` or `Device - Polling Time`. This command injection vulnerability allows an unauthenticated user to execute arbitrary commands if a `poller_item` with the `action` type `POLLER_ACTION_SCRIPT_PHP` (`2`) is configured. The authorization bypass should be prevented by not allowing an attacker to make `get_client_addr` (file `lib/functions.php`) return an arbitrary IP address. This could be done by not honoring the `HTTP_...` `$_SERVER` variables. If these should be kept for compatibility reasons it should at least be prevented to fake the IP address of the server running Cacti. This vulnerability has been addressed in both the 1.2.x and 1.3.x release branches with `1.2.23` being the first release containing the patch."
CVE-2022-38773,Affected devices do not contain an Immutable Root of Trust in Hardware. With this the integrity of the code executed on the device can not be validated during load-time. An attacker with physical access to the device could use this to replace the boot image of the device and execute arbitrary code.
CVE-2022-3656,Insufficient data validation in File System in Google Chrome prior to 107.0.5304.62 allowed a remote attacker to bypass file system restrictions via a crafted HTML page. (Chromium security severity: Medium)
CVE-2022-44877,login/index.php in CWP (aka Control Web Panel or CentOS Web Panel) 7 before 0.9.8.1147 allows remote attackers to execute arbitrary OS commands via shell metacharacters in the login parameter.
CVE-2022-41080,Microsoft Exchange Server Elevation of Privilege Vulnerability. This CVE ID is unique from CVE-2022-41123.
CVE-2023-21563,BitLocker Security Feature Bypass Vulnerability.
CVE-2023-21763,Microsoft Exchange Server Elevation of Privilege Vulnerability. This CVE ID is unique from CVE-2023-21764.
CVE-2022-41123,Microsoft Exchange Server Elevation of Privilege Vulnerability. This CVE ID is unique from CVE-2022-41080.
CVE-2023-21674,Windows Advanced Local Procedure Call (ALPC) Elevation of Privilege Vulnerability.
CVE-2023-21726,Windows Credential Manager User Interface Elevation of Privilege Vulnerability.
CVE-2022-41045,"Windows Advanced Local Procedure Call (ALPC) Elevation of Privilege Vulnerability. This CVE ID is unique from CVE-2022-41093, CVE-2022-41100."
CVE-2023-21678,"Windows Print Spooler Elevation of Privilege Vulnerability. This CVE ID is unique from CVE-2023-21760, CVE-2023-21765."
CVE-2023-21764,Microsoft Exchange Server Elevation of Privilege Vulnerability. This CVE ID is unique from CVE-2023-21763.
CVE-2023-21765,"Windows Print Spooler Elevation of Privilege Vulnerability. This CVE ID is unique from CVE-2023-21678, CVE-2023-21760."
CVE-2023-21760,"Windows Print Spooler Elevation of Privilege Vulnerability. This CVE ID is unique from CVE-2023-21678, CVE-2023-21765."
CVE-2023-21549,Windows SMB Witness Service Elevation of Privilege Vulnerability.
CVE-2022-41082,Microsoft Exchange Server Remote Code Execution Vulnerability.
CVE-2022-41093,"Windows Advanced Local Procedure Call (ALPC) Elevation of Privilege Vulnerability. This CVE ID is unique from CVE-2022-41045, CVE-2022-41100."
CVE-2023-21743,Microsoft SharePoint Server Security Feature Bypass Vulnerability.
CVE-2022-41100,"Windows Advanced Local Procedure Call (ALPC) Elevation of Privilege Vulnerability. This CVE ID is unique from CVE-2022-41045, CVE-2022-41093."
CVE-2022-23529,"node-jsonwebtoken is a JsonWebToken implementation for node.js. For versions `<= 8.5.1` of `jsonwebtoken` library, if a malicious actor has the ability to modify the key retrieval parameter (referring to the `secretOrPublicKey` argument from the readme link of the `jwt.verify()` function, they can write arbitrary files on the host machine. Users are affected only if untrusted entities are allowed to modify the key retrieval parameter of the `jwt.verify()` on a host that you control. This issue has been fixed, please update to version 9.0.0."
CVE-2022-41040,Microsoft Exchange Server Elevation of Privilege Vulnerability.
CVE-2022-35845,"Multiple improper neutralization of special elements used in an OS Command ('OS Command Injection') vulnerabilities [CWE-78] in FortiTester 7.1.0, 7.0 all versions, 4.0.0 through 4.2.0, 2.3.0 through 3.9.1 may allow an authenticated attacker to execute arbitrary commands in the underlying shell."
CVE-2022-39947,"A improper neutralization of special elements used in an os command ('os command injection') in Fortinet FortiADC version 7.0.0 through 7.0.2, FortiADC version 6.2.0 through 6.2.3, FortiADC version version 6.1.0 through 6.1.6, FortiADC version 6.0.0 through 6.0.4, FortiADC version 5.4.0 through 5.4.5 may allow an attacker to execute unauthorized code or commands via specifically crafted HTTP requests."
CVE-2022-43931,Out-of-bounds write vulnerability in Remote Desktop Functionality in Synology VPN Plus Server before 1.4.3-0534 and 1.4.4-0635 allows remote attackers to execute arbitrary commands via unspecified vectors.
CVE-2019-17233,Functions/EWD_UFAQ_Import.php in the ultimate-faqs plugin through 1.8.24 for WordPress allows HTML content injection.
CVE-2019-17232,Functions/EWD_UFAQ_Import.php in the ultimate-faqs plugin through 1.8.24 for WordPress allows unauthenticated options import.
CVE-2016-10972,The newspaper theme before 6.7.2 for WordPress has a lack of options access control via td_ajax_update_panel.
CVE-2018-18809,"The default server implementation of TIBCO Software Inc.'s TIBCO JasperReports Library, TIBCO JasperReports Library Community Edition, TIBCO JasperReports Library for ActiveMatrix BPM, TIBCO JasperReports Server, TIBCO JasperReports Server Community Edition, TIBCO JasperReports Server for ActiveMatrix BPM, TIBCO Jaspersoft for AWS with Multi-Tenancy, and TIBCO Jaspersoft Reporting and Analytics for AWS contains a directory-traversal vulnerability that may theoretically allow web server users to access contents of the host system. Affected releases are TIBCO Software Inc.'s TIBCO JasperReports Library: versions up to and including 6.3.4; 6.4.1; 6.4.2; 6.4.21; 7.1.0; 7.2.0, TIBCO JasperReports Library Community Edition: versions up to and including 6.7.0, TIBCO JasperReports Library for ActiveMatrix BPM: versions up to and including 6.4.21, TIBCO JasperReports Server: versions up to and including 6.3.4; 6.4.0; 6.4.1; 6.4.2; 6.4.3; 7.1.0, TIBCO JasperReports Server Community Edition: versions up to and including 6.4.3; 7.1.0, TIBCO JasperReports Server for ActiveMatrix BPM: versions up to and including 6.4.3, TIBCO Jaspersoft for AWS with Multi-Tenancy: versions up to and including 7.1.0, TIBCO Jaspersoft Reporting and Analytics for AWS: versions up to and including 7.1.0."
CVE-2018-5430,"The Spring web flows of TIBCO Software Inc.'s TIBCO JasperReports Server, TIBCO JasperReports Server Community Edition, TIBCO JasperReports Server for ActiveMatrix BPM, TIBCO Jaspersoft for AWS with Multi-Tenancy, and TIBCO Jaspersoft Reporting and Analytics for AWS contain a vulnerability which may allow any authenticated user read-only access to the contents of the web application, including key configuration files. Affected releases include TIBCO Software Inc.'s TIBCO JasperReports Server: versions up to and including 6.2.4; 6.3.0; 6.3.2; 6.3.3;6.4.0; 6.4.2, TIBCO JasperReports Server Community Edition: versions up to and including 6.4.2, TIBCO JasperReports Server for ActiveMatrix BPM: versions up to and including 6.4.2, TIBCO Jaspersoft for AWS with Multi-Tenancy: versions up to and including 6.4.2, TIBCO Jaspersoft Reporting and Analytics for AWS: versions up to and including 6.4.2."
CVE-2022-27518,Unauthenticated remote arbitrary code execution
CVE-2022-27510,Unauthorized access to Gateway user capabilities
CVE-2020-0688,"A remote code execution vulnerability exists in Microsoft Exchange software when the software fails to properly handle objects in memory, aka 'Microsoft Exchange Memory Corruption Vulnerability'."
CVE-2021-42321,Microsoft Exchange Server Remote Code Execution Vulnerability
CVE-2022-41697,A user enumeration vulnerability exists in the login functionality of Ghost Foundation Ghost 5.9.4. A specially-crafted HTTP request can lead to a disclosure of sensitive information. An attacker can send a series of HTTP requests to trigger this vulnerability.
